"97314620","https://img3.idealista.com/blur/WEB_LISTING/0/id.pro.es.image.master/8c/9a/23/975615240.jpg","1285-VI-934-050-002-00A","19","2","150000.0","flat","sale","84.0","True","3","2","Luis Buñuel","Madrid","Rivas-Vaciamadrid","Covibar - Pablo Iglesias","es","40.3624902","-3.5518749","False","https://www.idealista.com/inmueble/97314620/","14198","Oportunidad para inversores! Precio negociable. Interesante rentabilidad en alquiler; bien sea alquilando el inmueble en su conjunto, bien alquilando individualmente por habitaciones. Piso de 84 m2 construidos, en segunda planta exterior, sin ascensor. Consta de recibidor, cocina con terraza-tendedero cubierta, salón-comedor, tres dormitorios y dos baños. Tiene como anejo inseparable un trastero. El dormitorio principal tiene el baño incorporado en suite. La casa esta en condiciones de habitabilidad pero requiere ser actualizada. Cuenta con armarios empotrados, suelos de gres en toda la casa, y dispone de calefacción y agua caliente por gas natural. Finca del año 1986, ubicada en una plaza peatonal, fachada de ladrillo visto. Comunidad tranquila, con pocos vecinos, localizada en el barrio de Covibar-Pablo Iglesias, la parte del municipio más próximo a Madrid. El área cuenta con buenos servicios, entre ellos el IES Las Lagunas, el Colegio El Olivar, el Centro de Salud la Paz Rivas, la zona verde del Parque de Asturias, el Campo de Futbol El Vivero; y también con bancos, estancos, bares, restaurantes...","False","good","False","False","","","","1786.0","flat","","Covibar - Pablo Iglesias, Rivas-Vaciamadrid","Piso en Luis Buñuel","False","False","False","False","","","False","False","","","","","","","","","",""
"99603216","https://img3.idealista.com/blur/WEB_LISTING/0/id.pro.es.image.master/e3/0b/2b/1048931659.jpg","15011","14","","109000.0","chalet","sale","186.0","False","4","1","Campo Real","Madrid","Campo Real","","es","40.3395673","-3.3824544","False","https://www.idealista.com/inmueble/99603216/","4455","Casa de 3 plantas, 186 m² construidos y 119 m² útiles. En planta baja encontramos, 2 dormitorios, 1 baño con bañera, salón, cocina y patio. En planta primera dispone de 2 dormitorios. Buhardilla diáfana de 45m² muy luminosa. En cuanto a calidades cuenta con carpintería exterior de aluminio, carpintería interior de sapelli, suelos de terrazo, pintura de gotelé, calefacción eléctrica. Tiene todos los servicios muy cerca supermercados, colegios, farmacias. NO DEJES DE VISITARLO. Tenemos empresa de servicios financieros para ayudarte si lo necesitas. *Certificación Energética: ""G"" *Impuestos y gastos NO INCLUIDOS: ITP o IVA, notaría, registro, gestoría, tasación, etc.","False","renew","False","","","","","586.0","chalet","terracedHouse","Campo Real","Chalet adosado","False","False","False","False","","","False","False","","","","","","","","","",""
"99202797","https://img3.idealista.com/blur/WEB_LISTING/0/id.pro.es.image.master/cd/39/11/1038344390.jpg","","117","","370000.0","chalet","sale","271.0","False","3","3","Belmonte","Madrid","Velilla de San Antonio","","es","40.3681279","-3.4813016","False","https://www.idealista.com/inmueble/99202797/","9788","TULLAVE INMOBILLIARIA, vende en Velilla de San Antonio, chalet adosado de 271 m2 con parcela, piscina de obra con ducha y cenador. Ubicado en la mejor zona de la localidad, con todos los servicios en la puerta, parada de autobuses, auditorio María Pineda, biblioteca, restaurantes, supermercados. A 2 minutos andando del centro de salud y de la plaza del pueblo, donde se encuentra el ayuntamiento, bancos, farmacia, estanco,. y a 15 minutos en coche del Hospital del Henares y a 20 minutos del Aeropuerto Adolfo Suarez de Madrid. Muy bien comunicado por carretera, a 12 minutos del centro de Madrid por R3 y enlace directo a M40, M45, M50 y A3. Por su amplitud, tiene una distribución, en cuatro plantas, muy buena y muy cómoda.  Se accede a la vivienda por unas escaleras que dan acceso a un recibidor acristalado que a su vez da paso al interior de la vivienda, donde nos encontramos un hall distribuidor a amplio salón-comedor independiente de 60 m2 con salida a terraza con vistas a la piscina, aire acondicionado y chimenea de obra de piedra natural con cassette, cocina amueblada y semi-equipada ( placa de inducción, campana extractora, horno, lavavajillas y caldera ) con zona de office y aseo.  En primera planta nos encontramos tres dormitorios con armarios empotrados vestidos, uno de ellos en suite con el baño incorporado con bañera.  En planta segunda, zona abuhardillada diáfana con jacuzzi en esquina y amplio cuarto de baño de obra con plato de ducha con columna de hidromasaje y doble lavabo.  En planta sótano, espacio diáfano con chimenea de obra y aire acondicionado, cocina, cuarto de baño, 2 trasteros y acceso al patio trasero donde se encuentra la zona de piscina y porche techado.  En patio delantero, zona de leñera y acceso al garaje. Cuenta con todas las comodidades: - Puerta de acceso a la vivienda blindada, alarma, ventanas oscilobatientes en salón-comedor y el resto correderas de aluminio blanco y climalit, mosquiteras en toda la casa, suelos de plaqueta, aire acondicionado en salón y sótano, calefacción individual por gas natural. En planta baja paredes lisas y puertas lacadas en blanco y en primera y segunda planta puertas de roble y paredes de gotelé. Escaleras de mármol y barandilla de madera en blanco. toma de TV en. Puerta de acceso al garaje automática.  Disponemos de departamento financiero propio, consiguiéndole las mejores condiciones del mercado. Más de 15 años de experiencia y más de 2.000 hipotecas firmadas al año, nos avalan. Venga a verlo sin ningún tipo de compromiso. Blanca 621 37 28 26.","False","good","False","","True","True","","1365.0","chalet","terracedHouse","Velilla de San Antonio","Chalet adosado en Belmonte","False","False","False","False","","","False","False","","","","","","","","","",""
"99541576","https://img3.idealista.com/blur/WEB_LISTING/0/id.pro.es.image.master/d7/c9/ae/1046970971.jpg","15008","38","1","280000.0","flat","sale","155.0","False","3","2","Perlita","Madrid","Arganda","Perlita","es","40.2929218","-3.4468104","False","https://www.idealista.com/inmueble/99541576/","3820","¡Amplio y acogedor piso en una de las mejores urbanizaciones de Arganda del Rey! Si lo que buscas es tranquilidad, en una zona dotada de todos los servicios, sin duda, ¡esta es tu vivienda! Piso ideal para parejas o familias, ubicado en la urbanización “Residencial Marantina”, una comunidad con muy buenas calidades y muy amplia, con todos los servicios a tú alcance y estupendamente comunicado, en una de las mejores zonas de Arganda del Rey. Este bonito piso se encuentra en una primera planta de edificio con ascensor, dentro de urbanización privada con piscina comunitaria, pista de pádel, parque infantil zona de juego de petanca y amplios jardines para poder pasear en las tardes de primavera y verano. Además, cuenta con portero físico las 24 horas. Vivienda con 155 m² construidos y 122 m² útiles. Acedemos a la vivienda y encontramos un amplio hall de entrada que da acceso a un estupendo e independiente salón de 34 m², terraza de 8 m², cocina amueblada de 10 m² equipada con campana, vitrocerámica, horno y tendedero, 3 dormitorios muy amplios con armarios empotrados vestidos y 2 baños, uno de ellos en suite. El dormitorio más amplio mide 24,76 m² y el más pequeño 11 m², 1 plaza de garaje y trastero incluido en precio. Con orientación sureste. Cuenta con excelentes calidades: ventanas climalit, pre-instalación de A/C por conductos en todas las habitaciones, pintura lisa en toda la casa, suelos de tarima y gres. Puerta blindada. Toldos en la terraza. ¡NO DUDE EN VENIR A VERLO! Es el hogar que está buscando, muy cerca del hospital del Sureste, de la salida a la A3 y a 5 minutos del centro. *Certificación Energética: ""D"" *Impuestos y gastos NO INCLUIDOS: ITP o IVA, notaría, registro, gestoría, tasación, etc.","False","good","False","True","True","True","","1806.0","flat","","Perlita, Arganda","Piso","False","False","False","False","","","False","False","","","","","","","","","",""
"99535350","https://img3.idealista.com/blur/WEB_LISTING/0/id.pro.es.image.master/c7/7e/cc/1046763967.jpg","1498","35","","299000.0","chalet","sale","240.0","False","5","1","Centro","Madrid","Arganda","Centro","es","40.2997398","-3.4317697","False","https://www.idealista.com/inmueble/99535350/","2405","Vivienda muy luminosa y ubicada en el entorno idóneo para disfrutarlo, construida en 1971 y actualizada en el año 2000. Cerca de la plaza con todos los servicios que puedas necesitar. Casa de 240m² construidos y 220m² útiles. En la planta baja encontramos un acogedor salón para disfrutar de los ratos libres, la cocina dispone de muebles altos y bajo de la cual tenemos acceso al patio. En la primera planta podemos disfrutar de 5 habitaciones, 1 baño con bañera y un aseo. Dos de las habitaciones cuentan con una terraza corrida que nos permite tener unas preciosas vistas. En cuanto a calidades cuenta con carpintería exterior de aluminio y carpintería interior de roble, los suelos son de plaqueta y la pintura es lisa, máquina de A/C, gas individual de gasoil, garaje para dos coches y buhardilla diáfana de 100m². Si necesitas financiación podemos ayudarte. *Certificación Energética: ""F"" *Impuestos y gastos NO INCLUIDOS: ITP o IVA, notaría, registro, gestoría, tasación, etc.","False","good","False","","True","True","","1246.0","chalet","terracedHouse","Centro, Arganda","Chalet adosado","False","False","False","False","","","False","False","","","","","","","","","",""
"99502115","https://img3.idealista.com/blur/WEB_LISTING/0/id.pro.es.image.master/16/85/02/1045961280.jpg","RP1652022106667","31","1","271900.0","flat","sale","100.0","False","3","2","Rivas Urbanizaciones","Madrid","Rivas-Vaciamadrid","Rivas Urbanizaciones","es","40.3831382","-3.5393035","False","https://www.idealista.com/inmueble/99502115/","14546","Espectacular piso de 100m² construidos, ubicado en el familiar y juvenil Barrio de la Luna Rivas-Urbanizaciones, zona cercana a colegios, guarderías, farmacias, restaurantes, cafeterías, supermercados, centro deportivo Supera Rivas y líneas de autobuses. La vivienda consta de: Hall recibidor con armario de cortesía, amplio salón comedor de aprox 26m² con vistas a la urbanización, luminosa cocina equipada y amueblada con tendedero cubierto, 3 dormitorios, 2 baños (1 de ellos en suite con bañera y el otro con plato de ducha).  Además de 2 plazas de garaje y trastero.  Excelentes calidades, suelos cambiados a gres cerámico, puertas de madera, ventanas climalit con mosquiteras, toldos en todas las ventanas, amplios armarios empotrados, preinstalación del aire acondicionado. Urbanización cerrada con amplias zonas comunes, piscina, parque infantil, cancha de juegos y portero físico. Podemos conseguirle la mejor financiación con nuestro departamento financiero Dcredit!  Visítelo sin compromiso.","False","good","False","True","True","True","","2719.0","flat","","Rivas Urbanizaciones, Rivas-Vaciamadrid","Piso","False","False","False","False","","","False","False","","","","","","","","","",""
"99479767","https://img3.idealista.com/blur/WEB_LISTING/0/id.pro.es.image.master/85/7d/23/1045286033.jpg","15002","25","2","225000.0","flat","sale","128.0","True","3","2","Perlita","Madrid","Arganda","Perlita","es","40.2943714","-3.4473682","False","https://www.idealista.com/inmueble/99479767/","3822","Piso en venta en Arganda del Rey. Zona La Perlita. Ubicado en urbanización privada con piscina infantil y de adultos, parque infantil, zona deportiva y zonas verdes. Se trata de una espectacular vivienda, distribuida en 128m² construidos y 97m² útiles, entrando a la vivienda encontramos un distribuidor, dotado de armario empotrado, dando paso a un gran salón comedor muy luminoso de 30m² y acceso a una terraza de 8m², cocina amueblada muy espaciosa con despensa habilitada. Accedemos mediante un pasillo a los 3 dormitorios, siendo estos muy amplios, el dormitorio principal consta de vestidor, los otros dos dormitorios tienen cada uno su propio armario empotrado, 2 baños completos con doble lavabo y ventanas, uno de ellos en el dormitorio principal. En cuanto a calidades, esta vivienda dispone de suelos en parquet y gres, carpintería exterior en aluminio climalit, carpintería interior en madera de roble, calefacción individual de gas natural, la finca cuenta con ascensor, plaza de garaje y trastero. Fantásticas vistas despejadas, por tanto, aporta a la vivienda una gran luminosidad. Todas las comodidades a su alcance, y a tan sólo 2 minutos del Hospital del Sureste y de la salida A3. GRAN PRECIO, PARA UNA GRAN VIVIENDA. *Certificación Energética: ""E"" *Impuestos y gastos NO INCLUIDOS: ITP o IVA, notaría, registro, gestoría, tasación, etc.","False","good","False","True","True","True","","1758.0","flat","","Perlita, Arganda","Piso","False","False","False","False","","","False","False","","","","","","","","","",""
"99449251","https://img3.idealista.com/blur/WEB_LISTING/0/id.pro.es.image.master/14/58/55/1044323972.jpg","RP1652022106460","73","","559000.0","chalet","sale","208.0","False","5","3","Rivas Urbanizaciones","Madrid","Rivas-Vaciamadrid","Rivas Urbanizaciones","es","40.3727066","-3.5339205","False","https://www.idealista.com/inmueble/99449251/","13490","En venta espectacular chalet pareado de 208m² construidos sobre una parcela de 505m², la vivienda esta ubicada en la mejor zona de Rivas Urbanizaciones, cercano a colegios (I. E. S Duque de Rivas, C. E. I. P Victoria Kent, La Luna, Hipatia), centros comerciales (Zoco Rivas, Covibar II), centros deportivos, supermercados (Mercadona y AhorraMás) y gran variedad de comercios. La vivienda consta 3 plantas incluyendo el sótano que se distribuyen de la siguiente manera: PRIMERA PLANTA: hall recibidor, a mano derecha un dormitorio que actualmente se usa de despacho, reformada cocina amueblada y equipada con salida a patio, baño con plato de ducha, amplio salón con chimenea separado en dos partes ( comedor y sala de estar) y salida a amplio porche con preciosas vistas al patio trasero de la vivienda, subiendo las escaleras encontramos la: SEGUNDA PLANTA: con 3 amplios y luminosos dormitorios todos con armarios empotrados y dormitorio principal con vestidor y salida a terraza cerrada de aprox 8m², 2 baños (1 de ellos en suite con bañera y el otro con plato de ducha) Bajando a la ultima planta encontramos el sótano, con un amplio salón, 1 dormitorio y un espacio actualmente usado como bodega. Además de garaje con espacio para 2 coches. Primeras calidades: suelos cerámicos, ventanas doble climalit, puertas de roble y paredes lisas. Podemos conseguir la mejor financiación con nuestro departamento Dcredit!  Visítelo sin compromiso!","False","good","False","","True","True","","2688.0","chalet","semidetachedHouse","Rivas Urbanizaciones, Rivas-Vaciamadrid","Chalet pareado","False","False","False","False","","","False","False","","","","","","","","","",""
"99447438","https://img3.idealista.com/blur/WEB_LISTING/0/id.pro.es.image.master/55/88/23/1044267154.jpg","RP482022106413","42","3","339000.0","flat","sale","113.0","True","3","2","Rivas Futura","Madrid","Rivas-Vaciamadrid","Rivas Futura","es","40.3482338","-3.5217333","False","https://www.idealista.com/inmueble/99447438/","11201","Excelente piso de 113m² de construcción, situado en unas de las mejores urbanizaciones de Rivas Futura, cercana a diversos comercios, colegios, institutos, paradas de bus y a tan solo 7 minutos andando a la estación de metro.  Consta de hall recibidor con armario de cortesía, cocina amueblada con tendedero cubierto, 3 dormitorios con armarios empotrados, 2 baños (uno de ellos en suite), 1 plaza de garaje y trastero. Excelentes calidades, suelos de tarima, preinstalación del aire acondicionado, ventanas climalit doble cristal, terraza de 4m² a la cual se accede desde el dormitorio principal.  La urbanización cuenta con amplias zonas comunes, piscina de adultos y de niños, gimnasio con sauna, pista de pádel acristalada, parque infantil, salón comunitario y vigilancia las 24 horas.  Podemos conseguir la mejor financiación con nuestro departamento financiero Dcredit. Visítelo sin compromiso!","False","good","False","True","True","True","","3000.0","flat","","Rivas Futura, Rivas-Vaciamadrid","Piso","False","False","True","False","","","False","False","","","","","","","","","",""
"99432047","https://img3.idealista.com/blur/WEB_LISTING/0/id.pro.es.image.master/40/32/78/1045397860.jpg","RP1652022106411","44","2","379000.0","flat","sale","133.0","False","4","2","Rivas Urbanizaciones","Madrid","Rivas-Vaciamadrid","Rivas Urbanizaciones","es","40.3625913","-3.5427835","False","https://www.idealista.com/inmueble/99432047/","13526","A ESTRENAR espectacular piso de constructora LARVIN de 106m², ubicado en Rivas Urbanizaciones, a 10 min de la estación de metro de Rivas Urbanizaciones, Parque Lineal, Centro deportivo Cerro del Telegrafo, Centros medicos, colegios, gran variedad de comercio y paradas de autobuses. La vivienda consta de: hall recibidor con armario de cortesía, amplio salón comedor con salida a terraza con inmejorables vistas a las zonas verdes de la urbanización, cocina amueblada y equipada con tendedero cubierto conectado a terraza principal, 4 dormitorios con armarios empotrados, 2 baños (ambos con bañera) y 1 plaza de garaje. Primeras calidades: suelos de tarima, ventanas climalit y puertas de roble. La vivienda esta situada en una exclusiva urbanización con portero 24 horas, piscina, canchas de pádel y baloncesto, parque infantil y zonas verdes. Podemos conseguir la mejor financiación con nuestro departamento Dcredit!  No dude en visitarlo!","False","good","False","True","True","True","","2850.0","flat","","Rivas Urbanizaciones, Rivas-Vaciamadrid","Piso","False","False","False","False","","","False","False","","","","","","","","","",""
"99396189","https://img3.idealista.com/blur/WEB_LISTING/0/id.pro.es.image.master/22/06/ef/1042569436.jpg","RP482022106265","22","1","295000.0","flat","sale","93.0","True","3","2","Rivas Futura","Madrid","Rivas-Vaciamadrid","Rivas Futura","es","40.3389694","-3.5213018","False","https://www.idealista.com/inmueble/99396189/","10744","Piso de 93 m² con excelente ubicación, a tan solo 7 minutos caminando a la estación de metro y muy cercano al Cuartel de la Guardia, Civil, al Ambulatorio Primero de Mayo y a diversos comercio, servicios y paradas de bus. La vivienda consta de hall recibidor, cocina amueblada con tendedero cubierto, amplio salón comedor, 3 dormitorios con armarios empotrados, 2 baños (uno de ellos en suite), 2 plazas de garaje y trastero. El piso es muy luminoso y cuenta con aire acondicionado por conducto, paredes lisas, suelos de tarima y cerámico, orientación oeste. Urbanización cerrada con amplias zonas comunes, piscina de adultos y de niños, parque infantil y zona de aparcamiento para visitantes. Podemos conseguir la mejor financiación con nuestro departamento financiero Dcredit. Visítelo sin compromiso!","False","good","False","True","True","True","","3172.0","flat","","Rivas Futura, Rivas-Vaciamadrid","Piso","False","False","True","False","","","False","False","","","","","","","","","",""
"99380802","https://img3.idealista.com/blur/WEB_LISTING/0/id.pro.es.image.master/e4/67/e6/1042081870.jpg","RP2302022106177","35","","262500.0","chalet","sale","176.0","False","7","3","Perlita","Madrid","Arganda","Perlita","es","40.2945919","-3.4410701","False","https://www.idealista.com/inmueble/99380802/","3300","Redpiso Arganda Plaza pone a su disposición maravilloso chalet adosado en la zona de la Perlita. El inmueble cuenta con 251 m² útiles distribuidos en 4 plantas de la siguiente manera: Planta principal con un aseo de cortesía, salón y cocina independiente, hall de entrada acristalado. Primera planta, 3 dormitorios dobles uno de los cuales cuenta con baño en suite y todos ellos cuentan con armarios empotrados. Planta sótano con dos dormitorios de 10 m² y 8 m² respectivamente pudiéndoles dar el uso que se desee, 1 baño con plato de ducha y zona de aparcamiento de 20 m² con acceso al patio exterior de 35 m². Contamos con las siguientes calidades, paredes de gotelé, suelo parquet y cerámico (en cocina y baños), ventanas climalit, calefacción individual de gas natural, puerta de acceso a la vivienda blindad y puertas interiores de cerezo. Ubicado en zona residencial con muy buena comunicación, línea s de autobús desde la puerta (L1, L2, 330, 312 y 312ª) cercano a metro y buen acceso a las carreteras A3 y M313. Si quieres poder disfrutar de este fabuloso chalet con las mejores condiciones financieras en tu hipoteca ponemos a tu disposición nuestro departamento financiero Dcredit.","False","good","False","","True","True","","1491.0","chalet","terracedHouse","Perlita, Arganda","Chalet adosado","False","False","False","False","","","False","False","","","","","","","","","",""
